{
  "schema_version": 1,
  "status": "passed",
  "agent_next_step": "ready",
  "summary_json": "docs/fixtures/agent-decision-client-release-smoke-summary/passed.json",
  "evidence": {
    "release_ref": "v0.5.21",
    "installer_url": "https://raw.githubusercontent.com/sleticalboy/testloop-mcp/v0.5.21/scripts/install-agent-decision-client-ci-template.sh",
    "helper_refs": {
      "install": "v0.5.21",
      "consumer": "v0.5.21"
    },
    "fixture_count": 8,
    "decisions": [
      "accept",
      "accept",
      "accept",
      "manual-review",
      "manual-review",
      "manual-review",
      "apply-repair",
      "needs-better-input"
    ],
    "agent_next_steps": {
      "client": "ready",
      "consumer": "ready"
    }
  },
  "failures": []
}
